,RAW DATA,,,,,
743,A Crash Course in Causality:  Inferring Causal Effects from Observational Data,University of Pennsylvania,COURSE,4.70,Intermediate,"17,000.00"
744,Introduction to User Experience Principles and Processes,University of Michigan,COURSE,4.80,Beginner,"16,000.00"
745,Introduction to Electronics,Georgia Institute of Technology,COURSE,4.70,Mixed,"110,000.00"
746,Understanding Plants - Part I: What a Plant Knows,Tel Aviv University,COURSE,4.80,Beginner,"49,000.00"
747,"Innovation Through Design: Think, Make, Break, Repeat",The University of Sydney,COURSE,4.80,Beginner,"10,000.00"
748,Improving Leadership & Governance in Nonprofit Organizations,Luther College at the University of Regina,SPECIALIZATION,4.40,Beginner,"18,000.00"
749,Strategy and Sustainability,IESE Business School,COURSE,4.60,Beginner,"11,000.00"
750,"L'impact investing, la finance qui change le monde",ESSEC Business School,SPECIALIZATION,4.60,Beginner,"6,300.00"
751,Blended Language Learning: Design and Practice for Teachers,University of Colorado Boulder,COURSE,4.80,Intermediate,"1,900.00"
752,Analysing: Numeric and digital literacies,Macquarie University,SPECIALIZATION,4.60,Beginner,"7,900.00"
753,Astrobiology and the Search for Extraterrestrial Life,The University of Edinburgh,COURSE,4.70,Mixed,"66,000.00"
754,Spacecraft Dynamics and Control,University of Colorado Boulder,SPECIALIZATION,4.80,Advanced,"12,000.00"
755,"Leading for Equity, Diversity and Inclusion in Higher Education",University of Michigan,COURSE,4.70,Intermediate,"5,900.00"
756,Developing Your Musicianship,Berklee College of Music,COURSE,4.80,Mixed,"41,000.00"
757,Guitar for Beginners,Berklee College of Music,COURSE,4.80,Mixed,"210,000.00"
758,Introduction to Systems Engineering,UNSW Sydney (The University of New South Wales),COURSE,4.70,Mixed,"33,000.00"
759,The Cycle: Management of Successful Arts and Cultural Organizations,"University of Maryland, College Park",COURSE,4.80,Beginner,"11,000.00"
760,Supply Chain Operations,Rutgers the State University of New Jersey,COURSE,4.80,Beginner,"24,000.00"
761,Global Financing Solutions  (by EDHEC and Société Générale),EDHEC Business School,COURSE,4.60,Intermediate,"3,600.00"
762,Intercultural Management,ESCP Business School,COURSE,4.60,Beginner,"6,500.00"
763,Sample-based Learning Methods,University of Alberta,COURSE,4.80,Intermediate,"6,800.00"
764,Dairy Production and Management,The Pennsylvania State University,COURSE,4.80,Mixed,"23,000.00"
765,Palliative Care: It's Not Just Hospice Anymore,University of Colorado System,SPECIALIZATION,4.80,Beginner,"3,200.00"
766,Introduction to Statistics & Data Analysis in Public Health,Imperial College London,COURSE,4.70,Beginner,"12,000.00"
767,How To Create a Website in a Weekend! (Project-Centered Course),The State University of New York,COURSE,3.30,Mixed,"140,000.00"
768,The Changing Global Order,Universiteit Leiden,COURSE,4.70,Intermediate,"23,000.00"
769,Love as a Force for Social Justice,Stanford University,COURSE,4.70,Beginner,"14,000.00"
770,Enterprise Architecture,Peter the Great St. Petersburg Polytechnic University,COURSE,4.40,Beginner,"2,400.00"
771,"Ready, Set, Future! Introduction to Futures Thinking",Institute for the Future,COURSE,4.80,Beginner,"7,700.00"
772,Sexualidad...mucho más que sexo,Universidad de los Andes,COURSE,4.80,Beginner,"110,000.00"
773,Effective Compliance Programs,University of Pennsylvania,COURSE,4.90,Mixed,"3,400.00"
774,Introduction to Imagemaking,California Institute of the Arts,COURSE,4.50,Beginner,"54,000.00"
775,Foundations of Everyday Leadership,University of Illinois at Urbana-Champaign,COURSE,4.80,Mixed,"62,000.00"
776,Becoming a Sports Agent,Case Western Reserve University,COURSE,4.70,Beginner,"6,500.00"
777,Cloud Computing Basics (Cloud 101),LearnQuest,COURSE,4.50,Beginner,"37,000.00"
778,Finance for Non-Financial Managers,Emory University,COURSE,4.40,Intermediate,"12,000.00"
779,iOS App Development with Swift,University of Toronto,SPECIALIZATION,3.90,Intermediate,"76,000.00"
780,Introduction to Computer Programming,"Goldsmiths, University of London",COURSE,4.30,Beginner,"20,000.00"
781,Sales Training for High Performing Teams,HubSpot Academy,SPECIALIZATION,4.70,Beginner,"16,000.00"
782,Atención Primaria en Salud: El desafío de las Enfermedades no Transmisibles,Pontificia Universidad Católica de Chile,COURSE,4.80,Intermediate,"33,000.00"
783,Data Collection and Processing with Python,University of Michigan,COURSE,4.70,Intermediate,"19,000.00"
784,Music Business Foundations,Berklee College of Music,COURSE,4.90,Mixed,"34,000.00"
785,Hacia una práctica constructivista en el aula,Pontificia Universidad Católica de Chile,COURSE,4.80,Mixed,"62,000.00"
786,Learn English,Tsinghua University,SPECIALIZATION,4.30,Beginner,"22,000.00"
787,Wonders of Ancient Egypt,University of Pennsylvania,COURSE,4.80,Intermediate,"17,000.00"
788,Teaching Character and Creating Positive Classrooms,Relay Graduate School of Education,COURSE,4.80,Mixed,"53,000.00"
789,El Abogado del Futuro: Legaltech y la Transformación Digital del Derecho,Universidad Austral,COURSE,5.00,Beginner,"1,500.00"
790,Functional Programming Principles in Scala,École Polytechnique Fédérale de Lausanne,COURSE,4.80,Intermediate,"170,000.00"
791,Magic in the Middle Ages,Universitat de Barcelona,COURSE,4.60,Beginner,"78,000.00"
792,Six Sigma and the Organization (Advanced),University System of Georgia,COURSE,4.70,Intermediate,"15,000.00"
793,"Creatividad, diseño e innovación: Técnicas y herramientas",Arizona State University,SPECIALIZATION,4.70,Beginner,"150,000.00"
794,Construction Scheduling,Columbia University,COURSE,4.80,Beginner,"15,000.00"
795,New Approaches to Countering Terror: Countering Violent Extremism,"University of Maryland, College Park",COURSE,4.70,Beginner,"12,000.00"
796,Managing Your Health: The Role of Physical Therapy and Exercise,University of Toronto,COURSE,4.60,Beginner,"47,000.00"
797,Ancient Philosophy: Aristotle and His Successors,University of Pennsylvania,COURSE,4.80,Mixed,"8,100.00"
798,Strategising: Management for Global Competitive Advantage,Macquarie University,SPECIALIZATION,4.80,Intermediate,"30,000.00"
799,Antimicrobial resistance - theory and methods,Technical University of Denmark (DTU),COURSE,4.60,Intermediate,"63,000.00"
800,Cómo hablar bien en público,Universitat Autònoma de Barcelona,COURSE,4.80,Beginner,"55,000.00"
801,Strategic Management,Copenhagen Business School,COURSE,4.70,Mixed,"58,000.00"
802,Gender and Sexuality: Diversity and Inclusion in the Workplace,University of Pittsburgh,COURSE,4.70,Beginner,"14,000.00"
803,Hardware Description Languages for FPGA Design,University of Colorado Boulder,COURSE,4.20,Intermediate,"7,400.00"
804,Data Visualization with Advanced Excel,PwC,COURSE,4.80,Beginner,"60,000.00"
805,Influencer Marketing Strategy,Rutgers the State University of New Jersey,COURSE,4.40,Intermediate,"12,000.00"
806,Dentistry 101,University of Michigan,COURSE,4.70,Beginner,"4,500.00"
807,Teach English Now! Teaching Language Online,Arizona State University,COURSE,4.40,Intermediate,"8,500.00"
808,Preparing for the Google Cloud Associate Cloud Engineer Exam,Google Cloud,COURSE,4.70,Beginner,"22,000.00"
809,Become a Sustainable Business Change Agent,University of Colorado System,SPECIALIZATION,4.70,Intermediate,"4,200.00"
810,Patrocinio Deportivo,Universitat Autònoma de Barcelona,COURSE,4.60,Beginner,"12,000.00"
811,Математика и Python для анализа данных,E-Learning Development Fund,COURSE,4.80,Beginner,"67,000.00"
812,Data Analysis and Interpretation,Wesleyan University,SPECIALIZATION,4.40,Beginner,"100,000.00"
813,Decision-Making and Scenarios,University of Pennsylvania,COURSE,4.60,Mixed,"31,000.00"
814,"Sleep: Neurobiology, Medicine, and Society",University of Michigan,COURSE,4.80,Beginner,"20,000.00"
815,Control of Mobile Robots,Georgia Institute of Technology,COURSE,4.80,Mixed,"49,000.00"
816,BIM Fundamentals for Engineers,National Taiwan University,COURSE,4.60,Beginner,"13,000.00"
817,Social Entrepreneurship,Copenhagen Business School,SPECIALIZATION,4.60,Beginner,"13,000.00"
818,The Science of Gastronomy,The Hong Kong University of Science and Technology,COURSE,4.60,Mixed,"50,000.00"
819,Aboriginal Worldviews and Education,University of Toronto,COURSE,4.70,Mixed,"6,600.00"
820,Curanderismo: Traditional Healing Using Plants,University of New Mexico,COURSE,4.60,Beginner,"5,500.00"
821,Cybersecurity and Its Ten Domains,University System of Georgia,COURSE,4.20,Beginner,"140,000.00"
822,Strategic Business Management - Microeconomics,"University of California, Irvine",COURSE,4.70,Beginner,"9,500.00"
823,Quantitative Methods,University of Amsterdam,COURSE,4.70,Mixed,"69,000.00"
824,Building Your Leadership Skills,HEC Paris,COURSE,4.50,Mixed,"67,000.00"
825,Advertising and Society,Duke University,COURSE,4.80,Mixed,"14,000.00"
826,The Pronunciation of American English,"University of California, Irvine",SPECIALIZATION,4.60,Beginner,"1,700.00"
827,Queering Identities: LGBTQ+ Sexuality and Gender Identity,University of Colorado System,COURSE,4.90,Beginner,"3,000.00"
828,AWS Fundamentals: Migrating to the Cloud,Amazon Web Services,COURSE,4.50,Intermediate,"13,000.00"
829,What future for education?,UCL Institute of Education,COURSE,4.70,Mixed,"35,000.00"
830,Introduction to Ableton Live,Berklee College of Music,COURSE,4.80,Mixed,"60,000.00"
831,Machine Learning Foundations: A Case Study Approach,University of Washington,COURSE,4.60,Mixed,"240,000.00"
832,EMT Foundations,University of Colorado System,COURSE,4.80,Beginner,"7,100.00"
833,Russian Alphabet,Saint Petersburg State University,COURSE,4.70,Beginner,"3,200.00"
834,Internet Giants: The Law and Economics of Media Platforms,The University of Chicago,COURSE,4.80,Mixed,"38,000.00"
835,Global Financial Markets and Instruments,Rice University,COURSE,4.60,Mixed,"37,000.00"
836,Secure Coding Practices,"University of California, Davis",SPECIALIZATION,4.40,Intermediate,"6,400.00"
837,Instructional Methods in Health Professions Education,University of Michigan,COURSE,4.60,Intermediate,"9,700.00"
838,Actualización en el manejo del paciente con diabetes mellitus tipo 2,Universidad Nacional Autónoma de México,COURSE,4.80,Mixed,"23,000.00"
839,Legal Tech & Startups,IE Business School,COURSE,4.50,Intermediate,"7,200.00"
840,Materials Science: 10 Things Every Engineer Should Know,"University of California, Davis",COURSE,4.70,Mixed,"48,000.00"
841,Основы разработки на C++: белый пояс,E-Learning Development Fund,COURSE,4.90,Intermediate,"41,000.00"
842,Networking and Security Architecture with VMware NSX,VMware,COURSE,4.80,Intermediate,"17,000.00"
843,Linear Circuits 1: DC Analysis,Georgia Institute of Technology,COURSE,4.60,Mixed,"29,000.00"
844,Introduction aux Droits de l’Homme,University of Geneva,COURSE,4.80,Mixed,"46,000.00"
845,"High Performance Collaboration: Leadership, Teamwork, and Negotiation",Northwestern University,COURSE,4.80,Mixed,"46,000.00"
846,Agile и Scrum в работе над проектами и продуктами,ScrumTrek,COURSE,4.90,Beginner,"12,000.00"
847,Estadística y probabilidad,Universidad Nacional Autónoma de México,COURSE,4.70,Beginner,"27,000.00"
848,Classical Sociological Theory,University of Amsterdam,COURSE,4.80,Mixed,"51,000.00"
849,Google Cloud Platform Fundamentals for AWS Professionals,Google Cloud,COURSE,4.70,Intermediate,"36,000.00"
850,Introduction to Game Development,Michigan State University,COURSE,4.80,Mixed,"79,000.00"
851,Formulación y evaluación de proyectos complejos,Universidad de los Andes,COURSE,4.90,Intermediate,"4,400.00"
852,Digital Media and Marketing Strategies,University of Illinois at Urbana-Champaign,COURSE,4.40,Mixed,"57,000.00"
853,Age of Cathedrals,Yale University,COURSE,4.70,Beginner,"21,000.00"
854,Cost and Economics in Pricing Strategy,University of Virginia,COURSE,4.80,Beginner,"15,000.00"
855,Digital Business Models,Lund University,COURSE,4.50,Beginner,"21,000.00"
856,"Identifying, Monitoring, and Analyzing Risk and Incident Response and Recovery",(ISC)²,COURSE,4.90,Beginner,"1,700.00"
857,Fundamentos Estratégicos Empresariales,Universidad Nacional Autónoma de México,SPECIALIZATION,4.60,Beginner,"56,000.00"
858,¿Qué hacen los buenos directivos? Prioridades de la Alta Dirección,IESE Business School,COURSE,4.70,Beginner,"25,000.00"
859,Software Processes and Agile Practices,University of Alberta,COURSE,4.70,Mixed,"60,000.00"
860,Scaling Operations: Linking Strategy and Execution,Northwestern University,COURSE,4.50,Mixed,"12,000.00"
861,AWS Fundamentals: Building Serverless Applications,Amazon Web Services,COURSE,4.70,Beginner,"27,000.00"
862,Introduction to Big Data,University of California San Diego,COURSE,4.60,Mixed,"160,000.00"
863,Front-End Web Development with React,The Hong Kong University of Science and Technology,COURSE,4.70,Intermediate,"45,000.00"
864,The Economics of Health Care Delivery,University of Pennsylvania,COURSE,4.80,Mixed,"7,200.00"
865,Unity Certified Programmer Exam Preparation,Unity,SPECIALIZATION,4.50,Intermediate,"6,100.00"
866,Introdução à Ciência da Computação com Python Parte 1,Universidade de São Paulo,COURSE,4.90,Beginner,"120,000.00"
867,Osteoarchaeology: The Truth in Our Bones,Universiteit Leiden,COURSE,4.70,Beginner,"22,000.00"
868,Requirements Engineering: Secure Software  Specifications,University of Colorado System,SPECIALIZATION,4.60,Beginner,"7,200.00"
869,Python Classes and Inheritance,University of Michigan,COURSE,4.70,Intermediate,"21,000.00"
870,Electric Industry Operations and Markets,Duke University,COURSE,4.80,Beginner,"12,000.00"
871,Data and Health Indicators in Public Health Practice,Johns Hopkins University,COURSE,4.70,Beginner,"18,000.00"
872,Particle Physics: an Introduction,University of Geneva,COURSE,4.50,Mixed,"42,000.00"
873,Mathematics for Machine Learning: PCA,Imperial College London,COURSE,4.00,Intermediate,"33,000.00"
874,A Crash Course in Data Science,Johns Hopkins University,COURSE,4.50,Mixed,"130,000.00"
875,Русский как иностранный,Saint Petersburg State University,SPECIALIZATION,4.60,Intermediate,"9,800.00"
876,Research Data Management and Sharing,The University of Edinburgh,COURSE,4.60,Mixed,"16,000.00"
877,Aspectos básicos de la planificación y la gestión de proyectos,University of Virginia,COURSE,4.90,Beginner,"10,000.00"
878,Introduction to Genomic Technologies,Johns Hopkins University,COURSE,4.60,Mixed,"42,000.00"
879,Introduction to Chemistry:  Reactions and Ratios,Duke University,COURSE,4.80,Beginner,"46,000.00"
880,Explorando la Energía Sustentable,Pontificia Universidad Católica de Chile,COURSE,4.80,Beginner,"28,000.00"
881,Evaluación educativa,Universidad Nacional Autónoma de México,SPECIALIZATION,4.80,Beginner,"13,000.00"
882,University Teaching,The University of Hong Kong,COURSE,4.80,Beginner,"9,500.00"
883,Психолингвистика (Psycholinguistics),Saint Petersburg State University,COURSE,4.80,Mixed,"21,000.00"
884,Building Resilient Streaming Analytics Systems on GCP,Google Cloud,COURSE,4.60,Intermediate,"5,800.00"
885,Autodesk CAD/CAM for Manufacturing,Autodesk,SPECIALIZATION,4.80,Intermediate,"7,300.00"
886,Understanding Modern Finance,American Institute of Business and Economics,SPECIALIZATION,4.40,Intermediate,"11,000.00"
887,Object-Oriented Design,University of Alberta,COURSE,4.70,Intermediate,"33,000.00"
888,Aprende a programar con Python,Universidad Austral,SPECIALIZATION,4.20,Beginner,"6,600.00"
889,Погружение в Python,Moscow Institute of Physics and Technology,COURSE,4.70,Intermediate,"45,000.00"
890,Compassionate Leadership Through Service Learning with Jane Goodall and Roots & Shoots,University of Colorado Boulder,COURSE,4.90,Beginner,"6,400.00"